{
  "id": "030",
  "name": "newton_sqrt",
  "tier": 3,
  "concept": "numerical_iteration_convergence",
  "tags": [
    "numerical",
    "iteration",
    "floating_point"
  ],
  "description": "Compute sqrt(x) using Newton's method. Return result rounded to 6 decimal places.",
  "cpp_source": "#include <cmath>\ndouble newton_sqrt(double x) {\n    if (x < 0) return -1;\n    double guess = x / 2.0;\n    while (std::abs(guess * guess - x) > 1e-10)\n        guess = (guess + x / guess) / 2.0;\n    return std::round(guess * 1e6) / 1e6;\n}",
  "python_reference": "def newton_sqrt(x: float) -> float:\n    if x < 0: return -1.0\n    guess = x / 2.0\n    while abs(guess * guess - x) > 1e-10:\n        guess = (guess + x / guess) / 2.0\n    return round(guess, 6)",
  "mojo_reference": "import math\n\nfn newton_sqrt(x: Float64) -> Float64:\n    if x < 0: return -1.0\n    var guess = x / 2.0\n    while abs(guess * guess - x) > 1e-10:\n        guess = (guess + x / guess) / 2.0\n    return math.round(guess * 1e6) / 1e6",
  "tests": [
    {
      "args": [
        4.0
      ],
      "expected": "2.0"
    },
    {
      "args": [
        2.0
      ],
      "expected": "1.414214"
    },
    {
      "args": [
        9.0
      ],
      "expected": "3.0"
    },
    {
      "args": [
        0.0
      ],
      "expected": "0.0"
    }
  ]
}