{
  "id": "021",
  "name": "matrix_multiply",
  "tier": 3,
  "concept": "numerical_matrix",
  "tags": [
    "matrix",
    "numerical",
    "nested_loops"
  ],
  "description": "Multiply two 2D matrices A (m×k) and B (k×n). Return result matrix.",
  "cpp_source": "#include <vector>\nstd::vector<std::vector<int>> matrix_multiply(\n    const std::vector<std::vector<int>>& A,\n    const std::vector<std::vector<int>>& B) {\n    int m=A.size(), k=A[0].size(), n=B[0].size();\n    std::vector<std::vector<int>> C(m, std::vector<int>(n, 0));\n    for (int i=0;i<m;i++) for (int j=0;j<n;j++)\n        for (int p=0;p<k;p++) C[i][j] += A[i][p]*B[p][j];\n    return C;\n}",
  "python_reference": "def matrix_multiply(A: list, B: list) -> list:\n    m, k, n = len(A), len(A[0]), len(B[0])\n    C = [[0]*n for _ in range(m)]\n    for i in range(m):\n        for j in range(n):\n            for p in range(k):\n                C[i][j] += A[i][p] * B[p][j]\n    return C",
  "mojo_reference": "fn matrix_multiply(A: List[List[Int]], B: List[List[Int]]) -> List[List[Int]]:\n    var m = len(A); var k = len(A[0]); var n = len(B[0])\n    var C = List[List[Int]]()\n    for i in range(m):\n        var row = List[Int]()\n        for _ in range(n): row.append(0)\n        C.append(row)\n    for i in range(m):\n        for j in range(n):\n            for p in range(k):\n                C[i][j] += A[i][p] * B[p][j]\n    return C",
  "tests": [
    {
      "args": [
        [
          [
            1,
            2
          ],
          [
            3,
            4
          ]
        ],
        [
          [
            5,
            6
          ],
          [
            7,
            8
          ]
        ]
      ],
      "expected": "[[19, 22], [43, 50]]"
    },
    {
      "args": [
        [
          [
            1,
            0
          ],
          [
            0,
            1
          ]
        ],
        [
          [
            9,
            8
          ],
          [
            7,
            6
          ]
        ]
      ],
      "expected": "[[9, 8], [7, 6]]"
    }
  ]
}