{
  "id": "032",
  "name": "ep_safe_divide",
  "tier": 1,
  "concept": "numerical_guard",
  "tags": [
    "energyplus",
    "numerical_stability",
    "division",
    "real_world"
  ],
  "description": "Divide a by b, guarding against division by zero by clamping |b| to SMALL=1e-10. Source: EnergyPlus/General.cc SafeDivide().",
  "cpp_source": "// Source: EnergyPlus/src/EnergyPlus/General.cc — SafeDivide()\n#include <cmath>\ndouble ep_safe_divide(double a, double b) {\n    constexpr double SMALL = 1e-10;\n    if (std::abs(b) >= SMALL) return a / b;\n    return a / std::copysign(SMALL, b == 0.0 ? 1.0 : b);\n}",
  "python_reference": "import math\n\ndef ep_safe_divide(a: float, b: float) -> float:\n    SMALL = 1e-10\n    if abs(b) >= SMALL:\n        return a / b\n    return a / math.copysign(SMALL, b if b != 0.0 else 1.0)",
  "mojo_reference": "import math\n\nfn ep_safe_divide(a: Float64, b: Float64) -> Float64:\n    var SMALL: Float64 = 1e-10\n    if abs(b) >= SMALL:\n        return a / b\n    var sign_b = 1.0 if b >= 0.0 else -1.0\n    return a / (SMALL * sign_b)",
  "tests": [
    {
      "args": [
        10.0,
        2.0
      ],
      "expected": "5.0"
    },
    {
      "args": [
        -6.0,
        3.0
      ],
      "expected": "-2.0"
    },
    {
      "args": [
        0.0,
        5.0
      ],
      "expected": "0.0"
    },
    {
      "args": [
        7.5,
        0.25
      ],
      "expected": "30.0"
    }
  ]
}