{
  "id": "031",
  "name": "ep_ordinal_day",
  "tier": 2,
  "concept": "date_arithmetic",
  "tags": [
    "energyplus",
    "date",
    "lookup_table",
    "real_world"
  ],
  "description": "Return the day-of-year (1–365/366) for a given month, day, and leap-year flag. Source: EnergyPlus General.cc OrdinalDay(). Leap=1 adds a day for March onwards.",
  "cpp_source": "// Source: EnergyPlus/src/EnergyPlus/General.cc — OrdinalDay()\nint ep_ordinal_day(int month, int day, int leap) {\n    static constexpr int EndDayofMonth[12] = {31,59,90,120,151,181,212,243,273,304,334,365};\n    if (month == 1) return day;\n    if (month == 2) return day + EndDayofMonth[0];\n    return day + EndDayofMonth[month - 2] + leap;\n}",
  "python_reference": "def ep_ordinal_day(month: int, day: int, leap: int) -> int:\n    end_day = [31, 59, 90, 120, 151, 181, 212, 243, 273, 304, 334, 365]\n    if month == 1:\n        return day\n    if month == 2:\n        return day + end_day[0]\n    return day + end_day[month - 2] + leap",
  "mojo_reference": "fn ep_ordinal_day(month: Int, day: Int, leap: Int) -> Int:\n    var end_day = List[Int](31,59,90,120,151,181,212,243,273,304,334,365)\n    if month == 1:\n        return day\n    if month == 2:\n        return day + end_day[0]\n    return day + end_day[month - 2] + leap",
  "tests": [
    {
      "args": [
        1,
        15,
        0
      ],
      "expected": "15"
    },
    {
      "args": [
        2,
        28,
        0
      ],
      "expected": "59"
    },
    {
      "args": [
        3,
        1,
        0
      ],
      "expected": "60"
    },
    {
      "args": [
        3,
        1,
        1
      ],
      "expected": "61"
    },
    {
      "args": [
        12,
        31,
        0
      ],
      "expected": "365"
    }
  ]
}