{
  "id": "020",
  "name": "vector2d",
  "tier": 3,
  "concept": "oop_operator_overloading",
  "tags": [
    "oop",
    "operator_overloading",
    "class",
    "math"
  ],
  "description": "2D vector class supporting +, -, dot product and magnitude. Return (sum.x, sum.y, dot, magnitude_of_a).",
  "cpp_source": "#include <cmath>\n#include <tuple>\nstruct Vec2 {\n    double x, y;\n    Vec2(double x, double y) : x(x), y(y) {}\n    Vec2 operator+(const Vec2& o) const { return {x+o.x, y+o.y}; }\n    Vec2 operator-(const Vec2& o) const { return {x-o.x, y-o.y}; }\n    double dot(const Vec2& o)     const { return x*o.x + y*o.y; }\n    double magnitude()            const { return std::sqrt(x*x + y*y); }\n};\nstd::tuple<double,double,double,double>\nvector2d(double ax, double ay, double bx, double by) {\n    Vec2 a{ax,ay}, b{bx,by};\n    auto s = a + b;\n    return {s.x, s.y, a.dot(b), a.magnitude()};\n}",
  "python_reference": "import math\n\nclass Vec2:\n    def __init__(self, x, y): self.x, self.y = x, y\n    def __add__(self, o): return Vec2(self.x+o.x, self.y+o.y)\n    def __sub__(self, o): return Vec2(self.x-o.x, self.y-o.y)\n    def dot(self, o):     return self.x*o.x + self.y*o.y\n    def magnitude(self):  return math.sqrt(self.x**2 + self.y**2)\n\ndef vector2d(ax, ay, bx, by):\n    a, b = Vec2(ax, ay), Vec2(bx, by)\n    s = a + b\n    return (s.x, s.y, a.dot(b), a.magnitude())",
  "mojo_reference": "import math\n\nstruct Vec2:\n    var x: Float64\n    var y: Float64\n\n    fn __init__(inout self, x: Float64, y: Float64):\n        self.x = x; self.y = y\n\n    fn __add__(self, o: Vec2) -> Vec2:\n        return Vec2(self.x + o.x, self.y + o.y)\n\n    fn dot(self, o: Vec2) -> Float64:\n        return self.x * o.x + self.y * o.y\n\n    fn magnitude(self) -> Float64:\n        return math.sqrt(self.x ** 2 + self.y ** 2)\n\nfn vector2d(ax: Float64, ay: Float64, bx: Float64, by: Float64\n            ) -> Tuple[Float64, Float64, Float64, Float64]:\n    var a = Vec2(ax, ay)\n    var b = Vec2(bx, by)\n    var s = a + b\n    return (s.x, s.y, a.dot(b), a.magnitude())",
  "tests": [
    {
      "args": [
        3.0,
        4.0,
        1.0,
        2.0
      ],
      "expected": "(4.0, 6.0, 11.0, 5.0)"
    },
    {
      "args": [
        0.0,
        0.0,
        1.0,
        1.0
      ],
      "expected": "(1.0, 1.0, 0.0, 0.0)"
    }
  ]
}