{
  "id": "014",
  "name": "frequency_count",
  "tier": 3,
  "concept": "hashmap_counting",
  "tags": [
    "hashmap",
    "counting",
    "strings"
  ],
  "description": "Return a dict of character frequencies in the string.",
  "cpp_source": "#include <string>\n#include <map>\nstd::map<char,int> frequency_count(const std::string& s) {\n    std::map<char,int> freq;\n    for (char c : s) freq[c]++;\n    return freq;\n}",
  "python_reference": "def frequency_count(s: str) -> dict:\n    freq = {}\n    for c in s:\n        freq[c] = freq.get(c, 0) + 1\n    return freq",
  "mojo_reference": "fn frequency_count(s: String) -> Dict[String, Int]:\n    var freq = Dict[String, Int]()\n    for i in range(len(s)):\n        var c = s[i]\n        if c in freq:\n            freq[c] += 1\n        else:\n            freq[c] = 1\n    return freq",
  "tests": [
    {
      "args": [
        "hello"
      ],
      "expected": "{'h': 1, 'e': 1, 'l': 2, 'o': 1}"
    },
    {
      "args": [
        "aaa"
      ],
      "expected": "{'a': 3}"
    },
    {
      "args": [
        ""
      ],
      "expected": "{}"
    }
  ]
}