{
  "id": "039",
  "name": "ep_heat_vaporization",
  "tier": 2,
  "concept": "thermodynamic_formula",
  "tags": [
    "energyplus",
    "thermodynamics",
    "psychrometrics",
    "real_world"
  ],
  "description": "Compute latent heat of vaporization for moist air (J/kg) at temperature T (°C). Source: EnergyPlus/Psychrometrics.hh PsyHfgAirFnWTdb(). Formula: (2500940 + 1858.95·T) − 4180·T, where T=max(temp,0).",
  "cpp_source": "// Source: EnergyPlus/src/EnergyPlus/Psychrometrics.hh — PsyHfgAirFnWTdb()\n#include <algorithm>\ndouble ep_heat_vaporization(double temp) {\n    double t = std::max(temp, 0.0);\n    return (2500940.0 + 1858.95 * t) - (4180.0 * t);\n}",
  "python_reference": "def ep_heat_vaporization(temp: float) -> float:\n    t = max(temp, 0.0)\n    return (2500940.0 + 1858.95 * t) - (4180.0 * t)",
  "mojo_reference": "fn ep_heat_vaporization(temp: Float64) -> Float64:\n    var t = max(temp, 0.0)\n    return (2500940.0 + 1858.95 * t) - (4180.0 * t)",
  "tests": [
    {
      "args": [
        0.0
      ],
      "expected": "2500940.0"
    },
    {
      "args": [
        20.0
      ],
      "expected": "2454519.0"
    },
    {
      "args": [
        100.0
      ],
      "expected": "2268835.0"
    },
    {
      "args": [
        -10.0
      ],
      "expected": "2500940.0"
    }
  ]
}