{
  "id": "024",
  "name": "sieve_primes",
  "tier": 3,
  "concept": "sieve_boolean_array",
  "tags": [
    "number_theory",
    "sieve",
    "boolean_array"
  ],
  "description": "Return all primes up to n using the Sieve of Eratosthenes.",
  "cpp_source": "#include <vector>\nstd::vector<int> sieve_primes(int n) {\n    std::vector<bool> is_prime(n+1, true);\n    is_prime[0] = is_prime[1] = false;\n    for (int i = 2; i*i <= n; i++)\n        if (is_prime[i])\n            for (int j = i*i; j <= n; j += i)\n                is_prime[j] = false;\n    std::vector<int> primes;\n    for (int i = 2; i <= n; i++)\n        if (is_prime[i]) primes.push_back(i);\n    return primes;\n}",
  "python_reference": "def sieve_primes(n: int) -> list:\n    is_prime = [True] * (n + 1)\n    is_prime[0] = is_prime[1] = False\n    for i in range(2, int(n**0.5) + 1):\n        if is_prime[i]:\n            for j in range(i*i, n+1, i):\n                is_prime[j] = False\n    return [i for i in range(2, n+1) if is_prime[i]]",
  "mojo_reference": "fn sieve_primes(n: Int) -> List[Int]:\n    var is_prime = List[Bool]()\n    for _ in range(n + 1): is_prime.append(True)\n    is_prime[0] = False\n    if n > 0: is_prime[1] = False\n    var i = 2\n    while i * i <= n:\n        if is_prime[i]:\n            var j = i * i\n            while j <= n:\n                is_prime[j] = False\n                j += i\n        i += 1\n    var primes = List[Int]()\n    for k in range(2, n + 1):\n        if is_prime[k]: primes.append(k)\n    return primes",
  "tests": [
    {
      "args": [
        30
      ],
      "expected": "[2, 3, 5, 7, 11, 13, 17, 19, 23, 29]"
    },
    {
      "args": [
        10
      ],
      "expected": "[2, 3, 5, 7]"
    },
    {
      "args": [
        2
      ],
      "expected": "[2]"
    },
    {
      "args": [
        1
      ],
      "expected": "[]"
    }
  ]
}