{
  "id": "036",
  "name": "ep_to_upper",
  "tier": 1,
  "concept": "string_case_conversion",
  "tags": [
    "energyplus",
    "strings",
    "case",
    "real_world"
  ],
  "description": "Convert a string to uppercase (ASCII letters only). Source: EnergyPlus/UtilityRoutines.cc ConvertCaseToUpper() — original uses a custom character table; adapted here to std::toupper.",
  "cpp_source": "// Source: EnergyPlus/src/EnergyPlus/UtilityRoutines.cc — ConvertCaseToUpper()\n// (adapted: original uses explicit char table to be locale-independent)\n#include <string>\n#include <cctype>\n#include <algorithm>\nstd::string ep_to_upper(std::string s) {\n    std::transform(s.begin(), s.end(), s.begin(),\n                   [](unsigned char c){ return std::toupper(c); });\n    return s;\n}",
  "python_reference": "def ep_to_upper(s: str) -> str:\n    return s.upper()",
  "mojo_reference": "fn ep_to_upper(s: String) -> String:\n    return s.upper()",
  "tests": [
    {
      "args": [
        "hello"
      ],
      "expected": "HELLO"
    },
    {
      "args": [
        "HeLLo123"
      ],
      "expected": "HELLO123"
    },
    {
      "args": [
        ""
      ],
      "expected": ""
    },
    {
      "args": [
        "world"
      ],
      "expected": "WORLD"
    }
  ]
}