{
  "id": "027",
  "name": "activity_selection",
  "tier": 4,
  "concept": "greedy_interval_scheduling",
  "tags": [
    "greedy",
    "sorting",
    "intervals"
  ],
  "description": "Given start/end times, return the max number of non-overlapping activities.",
  "cpp_source": "#include <vector>\n#include <algorithm>\nint activity_selection(std::vector<int> start, std::vector<int> end) {\n    int n = start.size();\n    std::vector<int> idx(n);\n    std::iota(idx.begin(), idx.end(), 0);\n    std::sort(idx.begin(), idx.end(), [&](int a, int b){ return end[a]<end[b]; });\n    int count = 0, last_end = -1;\n    for (int i : idx) {\n        if (start[i] >= last_end) { count++; last_end = end[i]; }\n    }\n    return count;\n}",
  "python_reference": "def activity_selection(start: list, end: list) -> int:\n    activities = sorted(zip(end, start))\n    count, last_end = 0, -1\n    for e, s in activities:\n        if s >= last_end:\n            count += 1\n            last_end = e\n    return count",
  "mojo_reference": "fn activity_selection(start: List[Int], end_: List[Int]) -> Int:\n    var n = len(start)\n    var acts = List[Tuple[Int, Int]]()\n    for i in range(n):\n        acts.append((end_[i], start[i]))\n    sort(acts)\n    var count = 0\n    var last_end = -1\n    for act in acts:\n        var s = act[].get[1, Int]()\n        var e = act[].get[0, Int]()\n        if s >= last_end:\n            count += 1\n            last_end = e\n    return count",
  "tests": [
    {
      "args": [
        [
          1,
          3,
          0,
          5,
          8,
          5
        ],
        [
          2,
          4,
          6,
          7,
          9,
          9
        ]
      ],
      "expected": "4"
    },
    {
      "args": [
        [
          1,
          2,
          3
        ],
        [
          2,
          3,
          4
        ]
      ],
      "expected": "3"
    },
    {
      "args": [
        [
          0,
          2
        ],
        [
          1,
          4
        ]
      ],
      "expected": "2"
    }
  ]
}