{
  "id": "034",
  "name": "ep_int_in_range",
  "tier": 1,
  "concept": "range_validation",
  "tags": [
    "energyplus",
    "validation",
    "range",
    "real_world"
  ],
  "description": "Return True if value is in [lo, hi] inclusive. Source: EnergyPlus/PlantUtilities.cc IntegerIsWithinTwoValues().",
  "cpp_source": "// Source: EnergyPlus/src/EnergyPlus/PlantUtilities.cc — IntegerIsWithinTwoValues()\nbool ep_int_in_range(int value, int lo, int hi) {\n    return (value >= lo) && (value <= hi);\n}",
  "python_reference": "def ep_int_in_range(value: int, lo: int, hi: int) -> bool:\n    return lo <= value <= hi",
  "mojo_reference": "fn ep_int_in_range(value: Int, lo: Int, hi: Int) -> Bool:\n    return lo <= value <= hi",
  "tests": [
    {
      "args": [
        5,
        0,
        10
      ],
      "expected": "True"
    },
    {
      "args": [
        -1,
        0,
        10
      ],
      "expected": "False"
    },
    {
      "args": [
        0,
        0,
        10
      ],
      "expected": "True"
    },
    {
      "args": [
        11,
        0,
        10
      ],
      "expected": "False"
    }
  ]
}