{
  "id": "013",
  "name": "merge_sort",
  "tier": 2,
  "concept": "sorting_divide_and_conquer",
  "tags": [
    "sorting",
    "recursion",
    "divide_and_conquer"
  ],
  "description": "Sort a list of integers using merge sort. Return sorted list.",
  "cpp_source": "#include <vector>\nstd::vector<int> merge_sort(std::vector<int> arr) {\n    if (arr.size() <= 1) return arr;\n    int mid = arr.size() / 2;\n    auto left  = merge_sort(std::vector<int>(arr.begin(), arr.begin() + mid));\n    auto right = merge_sort(std::vector<int>(arr.begin() + mid, arr.end()));\n    std::vector<int> result;\n    int i = 0, j = 0;\n    while (i < (int)left.size() && j < (int)right.size())\n        result.push_back(left[i] < right[j] ? left[i++] : right[j++]);\n    while (i < (int)left.size())  result.push_back(left[i++]);\n    while (j < (int)right.size()) result.push_back(right[j++]);\n    return result;\n}",
  "python_reference": "def merge_sort(arr: list) -> list:\n    if len(arr) <= 1:\n        return arr\n    mid = len(arr) // 2\n    left, right = merge_sort(arr[:mid]), merge_sort(arr[mid:])\n    result, i, j = [], 0, 0\n    while i < len(left) and j < len(right):\n        if left[i] <= right[j]:\n            result.append(left[i]); i += 1\n        else:\n            result.append(right[j]); j += 1\n    return result + left[i:] + right[j:]",
  "mojo_reference": "fn merge_sort(arr: List[Int]) -> List[Int]:\n    if len(arr) <= 1:\n        return arr\n    var mid = len(arr) // 2\n    var left_arr = List[Int]()\n    var right_arr = List[Int]()\n    for i in range(mid):\n        left_arr.append(arr[i])\n    for i in range(mid, len(arr)):\n        right_arr.append(arr[i])\n    var left = merge_sort(left_arr)\n    var right = merge_sort(right_arr)\n    var result = List[Int]()\n    var i = 0\n    var j = 0\n    while i < len(left) and j < len(right):\n        if left[i] <= right[j]:\n            result.append(left[i]); i += 1\n        else:\n            result.append(right[j]); j += 1\n    while i < len(left):\n        result.append(left[i]); i += 1\n    while j < len(right):\n        result.append(right[j]); j += 1\n    return result",
  "tests": [
    {
      "args": [
        [
          5,
          2,
          8,
          1,
          9,
          3
        ]
      ],
      "expected": "[1, 2, 3, 5, 8, 9]"
    },
    {
      "args": [
        [
          1
        ]
      ],
      "expected": "[1]"
    },
    {
      "args": [
        [
          -3,
          0,
          5,
          -1
        ]
      ],
      "expected": "[-3, -1, 0, 5]"
    }
  ]
}