{
  "id": "006",
  "name": "fizzbuzz",
  "tier": 1,
  "concept": "conditionals_modulo",
  "tags": [
    "conditionals",
    "modulo",
    "string"
  ],
  "description": "Return FizzBuzz list for 1..n. Multiples of 3→Fizz, 5→Buzz, both→FizzBuzz.",
  "cpp_source": "#include <vector>\n#include <string>\nstd::vector<std::string> fizzbuzz(int n) {\n    std::vector<std::string> result;\n    for (int i = 1; i <= n; i++) {\n        if (i % 15 == 0)      result.push_back(\"FizzBuzz\");\n        else if (i % 3 == 0)  result.push_back(\"Fizz\");\n        else if (i % 5 == 0)  result.push_back(\"Buzz\");\n        else                   result.push_back(std::to_string(i));\n    }\n    return result;\n}",
  "python_reference": "def fizzbuzz(n: int) -> list:\n    result = []\n    for i in range(1, n + 1):\n        if i % 15 == 0:   result.append('FizzBuzz')\n        elif i % 3 == 0:  result.append('Fizz')\n        elif i % 5 == 0:  result.append('Buzz')\n        else:             result.append(str(i))\n    return result",
  "mojo_reference": "fn fizzbuzz(n: Int) -> List[String]:\n    var result = List[String]()\n    for i in range(1, n + 1):\n        if i % 15 == 0:\n            result.append(String(\"FizzBuzz\"))\n        elif i % 3 == 0:\n            result.append(String(\"Fizz\"))\n        elif i % 5 == 0:\n            result.append(String(\"Buzz\"))\n        else:\n            result.append(str(i))\n    return result",
  "tests": [
    {
      "args": [
        15
      ],
      "expected": "['1', '2', 'Fizz', '4', 'Buzz', 'Fizz', '7', '8', 'Fizz', 'Buzz', '11', 'Fizz', '13', '14', 'FizzBuzz']"
    },
    {
      "args": [
        5
      ],
      "expected": "['1', '2', 'Fizz', '4', 'Buzz']"
    }
  ]
}