{
  "id": "035",
  "name": "ep_azimuth_diff",
  "tier": 2,
  "concept": "circular_angle_arithmetic",
  "tags": [
    "energyplus",
    "geometry",
    "angles",
    "real_world"
  ],
  "description": "Return the shortest angular distance (0–180°) between two azimuth angles in degrees. Source: EnergyPlus/General.cc rotAzmDiffDeg().",
  "cpp_source": "// Source: EnergyPlus/src/EnergyPlus/General.cc — rotAzmDiffDeg()\n#include <cmath>\ndouble ep_azimuth_diff(double azm_a, double azm_b) {\n    double diff = azm_b - azm_a;\n    if (diff > 180.0)       diff = 360.0 - diff;\n    else if (diff < -180.0) diff = 360.0 + diff;\n    return std::abs(diff);\n}",
  "python_reference": "def ep_azimuth_diff(azm_a: float, azm_b: float) -> float:\n    diff = azm_b - azm_a\n    if diff > 180.0:\n        diff = 360.0 - diff\n    elif diff < -180.0:\n        diff = 360.0 + diff\n    return abs(diff)",
  "mojo_reference": "fn ep_azimuth_diff(azm_a: Float64, azm_b: Float64) -> Float64:\n    var diff = azm_b - azm_a\n    if diff > 180.0:\n        diff = 360.0 - diff\n    elif diff < -180.0:\n        diff = 360.0 + diff\n    return abs(diff)",
  "tests": [
    {
      "args": [
        10.0,
        20.0
      ],
      "expected": "10.0"
    },
    {
      "args": [
        10.0,
        200.0
      ],
      "expected": "170.0"
    },
    {
      "args": [
        350.0,
        10.0
      ],
      "expected": "20.0"
    },
    {
      "args": [
        0.0,
        270.0
      ],
      "expected": "90.0"
    }
  ]
}