{
  "id": "023",
  "name": "gcd_lcm",
  "tier": 2,
  "concept": "number_theory_gcd",
  "tags": [
    "number_theory",
    "recursion",
    "math"
  ],
  "description": "Return (gcd, lcm) of two positive integers using Euclidean algorithm.",
  "cpp_source": "#include <tuple>\nint gcd(int a, int b) { return b == 0 ? a : gcd(b, a % b); }\nstd::tuple<int,int> gcd_lcm(int a, int b) {\n    int g = gcd(a, b);\n    return {g, a / g * b};\n}",
  "python_reference": "import math\n\ndef gcd_lcm(a: int, b: int) -> tuple:\n    g = math.gcd(a, b)\n    return (g, a // g * b)",
  "mojo_reference": "fn gcd(a: Int, b: Int) -> Int:\n    if b == 0: return a\n    return gcd(b, a % b)\n\nfn gcd_lcm(a: Int, b: Int) -> Tuple[Int, Int]:\n    var g = gcd(a, b)\n    return (g, a // g * b)",
  "tests": [
    {
      "args": [
        12,
        18
      ],
      "expected": "(6, 36)"
    },
    {
      "args": [
        7,
        13
      ],
      "expected": "(1, 91)"
    },
    {
      "args": [
        100,
        75
      ],
      "expected": "(25, 300)"
    }
  ]
}