{
  "id": "005",
  "name": "run_length_encode",
  "tier": 2,
  "concept": "string_compression",
  "tags": [
    "strings",
    "encoding",
    "grouping"
  ],
  "description": "Compress a string using run-length encoding. 'aaabbc' → '3a2b1c'.",
  "cpp_source": "#include <string>\nstd::string run_length_encode(const std::string& s) {\n    if (s.empty()) return \"\";\n    std::string result;\n    int count = 1;\n    for (int i = 1; i <= (int)s.size(); i++) {\n        if (i < (int)s.size() && s[i] == s[i-1]) {\n            count++;\n        } else {\n            result += std::to_string(count) + s[i-1];\n            count = 1;\n        }\n    }\n    return result;\n}",
  "python_reference": "def run_length_encode(s: str) -> str:\n    if not s:\n        return ''\n    result, count = [], 1\n    for i in range(1, len(s)):\n        if s[i] == s[i - 1]:\n            count += 1\n        else:\n            result.append(str(count) + s[i - 1])\n            count = 1\n    result.append(str(count) + s[-1])\n    return ''.join(result)",
  "mojo_reference": "fn run_length_encode(s: String) -> String:\n    if len(s) == 0:\n        return String(\"\")\n    var result = String(\"\")\n    var count = 1\n    for i in range(1, len(s) + 1):\n        if i < len(s) and s[i] == s[i - 1]:\n            count += 1\n        else:\n            result += str(count) + s[i - 1]\n            count = 1\n    return result",
  "tests": [
    {
      "args": [
        "aaabbc"
      ],
      "expected": "3a2b1c"
    },
    {
      "args": [
        "abcd"
      ],
      "expected": "1a1b1c1d"
    },
    {
      "args": [
        "aaaaaa"
      ],
      "expected": "6a"
    },
    {
      "args": [
        ""
      ],
      "expected": ""
    }
  ]
}