{
  "id": "017",
  "name": "bst_insert_search",
  "tier": 3,
  "concept": "binary_tree_recursion",
  "tags": [
    "tree",
    "recursion",
    "oop",
    "pointers"
  ],
  "description": "Insert values into a BST, then return sorted in-order traversal.",
  "cpp_source": "#include <vector>\nstruct Node { int val; Node *left=nullptr, *right=nullptr; Node(int v):val(v){} };\nNode* insert(Node* root, int val) {\n    if (!root) return new Node(val);\n    if (val < root->val) root->left  = insert(root->left,  val);\n    else                 root->right = insert(root->right, val);\n    return root;\n}\nvoid inorder(Node* root, std::vector<int>& out) {\n    if (!root) return;\n    inorder(root->left, out);\n    out.push_back(root->val);\n    inorder(root->right, out);\n}\nstd::vector<int> bst_insert_search(std::vector<int> values) {\n    Node* root = nullptr;\n    for (int v : values) root = insert(root, v);\n    std::vector<int> out;\n    inorder(root, out);\n    return out;\n}",
  "python_reference": "class Node:\n    def __init__(self, val):\n        self.val = val\n        self.left = self.right = None\n\ndef insert(root, val):\n    if root is None: return Node(val)\n    if val < root.val: root.left  = insert(root.left,  val)\n    else:              root.right = insert(root.right, val)\n    return root\n\ndef inorder(root):\n    if root is None: return []\n    return inorder(root.left) + [root.val] + inorder(root.right)\n\ndef bst_insert_search(values: list) -> list:\n    root = None\n    for v in values: root = insert(root, v)\n    return inorder(root)",
  "mojo_reference": "struct Node:\n    var val: Int\n    var left: Int   # index into nodes list (-1 = None)\n    var right: Int\n\n    fn __init__(inout self, v: Int):\n        self.val = v; self.left = -1; self.right = -1\n\nfn bst_insert_search(values: List[Int]) -> List[Int]:\n    var nodes = List[Node]()\n    var root = -1\n    for v in values:\n        var idx = len(nodes)\n        nodes.append(Node(v[]))\n        if root == -1:\n            root = idx; continue\n        var cur = root\n        while True:\n            if v[] < nodes[cur].val:\n                if nodes[cur].left == -1: nodes[cur].left = idx; break\n                else: cur = nodes[cur].left\n            else:\n                if nodes[cur].right == -1: nodes[cur].right = idx; break\n                else: cur = nodes[cur].right\n    var out = List[Int]()\n    var stack = List[Int]()\n    var cur = root\n    while cur != -1 or len(stack) > 0:\n        while cur != -1:\n            stack.append(cur); cur = nodes[cur].left\n        cur = stack.pop()\n        out.append(nodes[cur].val)\n        cur = nodes[cur].right\n    return out",
  "tests": [
    {
      "args": [
        [
          5,
          3,
          7,
          1,
          4,
          6,
          8
        ]
      ],
      "expected": "[1, 3, 4, 5, 6, 7, 8]"
    },
    {
      "args": [
        [
          1,
          2,
          3
        ]
      ],
      "expected": "[1, 2, 3]"
    },
    {
      "args": [
        [
          5,
          1,
          9,
          2
        ]
      ],
      "expected": "[1, 2, 5, 9]"
    }
  ]
}